{
  "$schema": "https://arkhe.dev/schemas/golden-vectors-v1.json",
  "version": "AKG-CBOR-v1",
  "generated_by": "hand-authored-contract",
  "generated_at": "2026-10-17T00:00:00Z",
  "vectors": [
    {
      "id": "BLAKE3-001",
      "component": "BLAKE3",
      "normative_source": "BLAKE3 Official Test Vectors (empty input)",
      "description": "BLAKE3 hash of empty input (32-byte output)",
      "input": {
        "data_hex": "",
        "domain": "none"
      },
      "expected_output": {
        "hash_hex": "af1349b9f5f9a1a6a0404dea36dcc9499bcb25c9adc112b7cc9a93cae41f3262"
      }
    },
    {
      "id": "BLAKE3-002",
      "component": "BLAKE3",
      "normative_source": "BLAKE3 Official Test Vectors (input 'abc')",
      "description": "BLAKE3 hash of ASCII 'abc'",
      "input": {
        "data_hex": "616263",
        "domain": "none"
      },
      "expected_output": {
        "hash_hex": "6437b3ac38465133ffb63b75273a8db548c558465d79db03fd359c6cd5bd9d85"
      }
    },
    {
      "id": "GGUF-CANON-001",
      "component": "GGUF Canonicalization",
      "normative_source": "AKG-CBOR-v1 (RFC 8949 \u00a74.2.1)",
      "description": "Canonical CBOR encoding of GGUF metadata map",
      "input": {
        "metadata": {
          "architecture": "llama",
          "context_length": 4096,
          "license": "MIT"
        }
      },
      "expected_output": {
        "canonical_cbor_hex": "a3676c6963656e7365634d49546c617263686974656374757265656c6c616d616e636f6e746578745f6c656e677468191000",
        "canonical_hash_hex": "f21ac0a3545177abf1fac5a4b315ad6db71b5495febfdfc5e0db0a6273a34d12"
      }
    },
    {
      "id": "MMR-001",
      "component": "WormGraph MMR",
      "normative_source": "RFC 6962 (Merkle Tree) + Arkhe Domain Separation",
      "description": "Merkle Mountain Range of 1 leaves, inclusion proof for leaf index 0",
      "input": {
        "leaves": [
          "0000000000000000000000000000000000000000000000000000000000000001"
        ],
        "target_index": 0,
        "hash_function": "BLAKE3",
        "leaf_prefix": "00",
        "node_prefix": "01",
        "bagging_prefix": "02"
      },
      "expected_output": {
        "root_hash_hex": "60499eb380feaca0c5b5385982e20abe3b4b3ef7ff5037dfad344b5f8a802c7b",
        "inclusion_proof_hashes": [],
        "inclusion_proof_directions": []
      }
    },
    {
      "id": "MMR-003",
      "component": "WormGraph MMR",
      "normative_source": "RFC 6962 (Merkle Tree) + Arkhe Domain Separation",
      "description": "Merkle Mountain Range of 3 leaves, inclusion proof for leaf index 1",
      "input": {
        "leaves": [
          "0000000000000000000000000000000000000000000000000000000000000001",
          "0000000000000000000000000000000000000000000000000000000000000002",
          "0000000000000000000000000000000000000000000000000000000000000003"
        ],
        "target_index": 1,
        "hash_function": "BLAKE3",
        "leaf_prefix": "00",
        "node_prefix": "01",
        "bagging_prefix": "02"
      },
      "expected_output": {
        "root_hash_hex": "28d9a54dcaf41834f8473d8bdd23d32cafbbda453f62fe69a7b583d9bd80b403",
        "inclusion_proof_hashes": [
          "60499eb380feaca0c5b5385982e20abe3b4b3ef7ff5037dfad344b5f8a802c7b",
          "00f32b9b5d0c34bf15d666e0f470631491902efe447db7c262a1d54d3ff591c5"
        ],
        "inclusion_proof_directions": [
          "left",
          "right"
        ]
      }
    },
    {
      "id": "MMR-004",
      "component": "WormGraph MMR",
      "normative_source": "RFC 6962 (Merkle Tree) + Arkhe Domain Separation",
      "description": "Merkle Mountain Range of 4 leaves, inclusion proof for leaf index 2",
      "input": {
        "leaves": [
          "0000000000000000000000000000000000000000000000000000000000000001",
          "0000000000000000000000000000000000000000000000000000000000000002",
          "0000000000000000000000000000000000000000000000000000000000000003",
          "0000000000000000000000000000000000000000000000000000000000000004"
        ],
        "target_index": 2,
        "hash_function": "BLAKE3",
        "leaf_prefix": "00",
        "node_prefix": "01",
        "bagging_prefix": "02"
      },
      "expected_output": {
        "root_hash_hex": "ff55b1c86c203cbc5c84a79803d4f921e317a8e72c0645535db4c1cc2e7d5d94",
        "inclusion_proof_hashes": [
          "ae0a16419db8f57ecc730b1fcd8c2957637e5a5dbd83078960759a9b9bf8b637",
          "f372742b780b1e913a79685dfa797b92716f38576d35b08840a369eafb26360c"
        ],
        "inclusion_proof_directions": [
          "right",
          "left"
        ]
      }
    },
    {
      "id": "MMR-005",
      "component": "WormGraph MMR",
      "normative_source": "RFC 6962 (Merkle Tree) + Arkhe Domain Separation",
      "description": "Merkle Mountain Range of 5 leaves, inclusion proof for leaf index 2",
      "input": {
        "leaves": [
          "0000000000000000000000000000000000000000000000000000000000000001",
          "0000000000000000000000000000000000000000000000000000000000000002",
          "0000000000000000000000000000000000000000000000000000000000000003",
          "0000000000000000000000000000000000000000000000000000000000000004",
          "0000000000000000000000000000000000000000000000000000000000000005"
        ],
        "target_index": 2,
        "hash_function": "BLAKE3",
        "leaf_prefix": "00",
        "node_prefix": "01",
        "bagging_prefix": "02"
      },
      "expected_output": {
        "root_hash_hex": "a9a1c863d2140bbe6490017e8a4fada443ef7b48a9a975c0b873619a87e51a31",
        "inclusion_proof_hashes": [
          "ae0a16419db8f57ecc730b1fcd8c2957637e5a5dbd83078960759a9b9bf8b637",
          "f372742b780b1e913a79685dfa797b92716f38576d35b08840a369eafb26360c",
          "014486f26ca863608c1ffb242275bbcbcf1479a662124e631d1719a0b795f71a"
        ],
        "inclusion_proof_directions": [
          "right",
          "left",
          "right"
        ]
      }
    },
    {
      "id": "MMR-007",
      "component": "WormGraph MMR",
      "normative_source": "RFC 6962 (Merkle Tree) + Arkhe Domain Separation",
      "description": "Merkle Mountain Range of 7 leaves, inclusion proof for leaf index 3",
      "input": {
        "leaves": [
          "0000000000000000000000000000000000000000000000000000000000000001",
          "0000000000000000000000000000000000000000000000000000000000000002",
          "0000000000000000000000000000000000000000000000000000000000000003",
          "0000000000000000000000000000000000000000000000000000000000000004",
          "0000000000000000000000000000000000000000000000000000000000000005",
          "0000000000000000000000000000000000000000000000000000000000000006",
          "0000000000000000000000000000000000000000000000000000000000000007"
        ],
        "target_index": 3,
        "hash_function": "BLAKE3",
        "leaf_prefix": "00",
        "node_prefix": "01",
        "bagging_prefix": "02"
      },
      "expected_output": {
        "root_hash_hex": "5689a464f5d6ad7869a43491c10a1d8da7fa869c3081d8515053ca5cc2827d4b",
        "inclusion_proof_hashes": [
          "00f32b9b5d0c34bf15d666e0f470631491902efe447db7c262a1d54d3ff591c5",
          "f372742b780b1e913a79685dfa797b92716f38576d35b08840a369eafb26360c",
          "49ccded809e3ef3f4bb382556dcd13adbd0fcb7611f22fc31c83e3c6e8efb43c"
        ],
        "inclusion_proof_directions": [
          "left",
          "left",
          "right"
        ]
      }
    },
    {
      "id": "C2PA-001",
      "component": "C2PA Manifest Parsing",
      "normative_source": "C2PA Spec 2.3 (Claim Canonicalization)",
      "description": "Extraction and canonicalization of C2PA claim-map-v2 fields",
      "input": {
        "claim_json": {
          "alg": "sha256",
          "claim_generator": "Arkhe/1.0",
          "claim_generator_info": [
            {
              "name": "Arkhe",
              "version": "1.0"
            }
          ],
          "created_assertions": [],
          "format": "image/jpeg",
          "instanceID": "xmp:iid:12345",
          "signature": "sig_dummy",
          "title": "test_asset.jpg"
        }
      },
      "expected_output": {
        "canonical_cbor_hex": "a863616c6766736861323536657469746c656e746573745f61737365742e6a706766666f726d61746a696d6167652f6a706567697369676e6174757265697369675f64756d6d796a696e7374616e636549446d786d703a6969643a31323334356f636c61696d5f67656e657261746f726941726b68652f312e3072637265617465645f617373657274696f6e738074636c61696d5f67656e657261746f725f696e666f81a2646e616d656541726b68656776657273696f6e63312e30",
        "claim_hash_hex": "f9a369efa8e13afafa63b58628573c7b1f465416b0b7aeff499eea6466578e53"
      }
    },
    {
      "id": "C2PA-NEG-001",
      "component": "C2PA Manifest Parsing",
      "normative_source": "C2PA Spec 2.3 (Claim Canonicalization)",
      "description": "Invalid C2PA claim missing required v2 fields and using wrong alg",
      "input": {
        "claim_json": {
          "alg": "Ed25519",
          "claim_generator": "Arkhe/1.0",
          "format": "image/jpeg",
          "title": "test_asset.jpg"
        }
      },
      "expected_output": {
        "error": "Invalid claim-map-v2: missing instanceID, signature, created_assertions. alg must be a hash algorithm.",
        "canonical_cbor_hex": "a463616c676745643235353139657469746c656e746573745f61737365742e6a706766666f726d61746a696d6167652f6a7065676f636c61696d5f67656e657261746f726941726b68652f312e30",
        "claim_hash_hex": "27708acae56f208515e478728a6be1366bb2e6ac288586936b367cbc7c436781"
      }
    }
  ]
}